word,definition
Cat,"Better than a human could ever be. Here's why-1) Look into a cat's face. You should be able to tell that they know something you don't.2) They get to sleep 18 hours a day and play for the entire other 6.3) Who is cleaning up who's litter box here?4) They are able to move faster than you can, can land on their feet, and can move through tighter spaces than you can.5) Dogs have owners; Cats have staff."
Manbaby,"A man who acts like a baby. If he doesn't get his way, he becomes crabby and unable to work with. thinks he's always right. Can be angered and upset by anything.Must proceed with caution!If you come into contact with a Manbaby, back away quickly and run like hell.Manbaby's are good at concealing themselves amongst society. They seem normal at first but throw fits not long after dating them. Be wary."
dan,"Dan is funny, hot, sexy, hes such a great guy and is very good-looking, everyone wants to be him and every girl wants to have hot steamy sex with him and play with him  and he has the coolest name in the whole fucking world!!!!!!!!!!"
Kazoo Parade,The act of performing fellatio on a series of flaccid penises.
tekken,"GREATEST FIGHTING GAME EVERunmatched depth in gameplay.  Probably take 10 years to master all the layers of depth within just tekken 3.  Button mashing aint gonna get you far on this one.  The fighting system isnt based on over the top infinities, shooting fireballs, or over powered moves.  Yet it is still so fun."
Observational Humor,"A skit on the Tom Green Show.Tom Green observes people on the streets, and yells at them from up close with a megaphone, pointing out what they are doing.This often startles and/or frightens people."
The Urban School,"The Urban School is a small private school located on Page St. between Masonic and Ashbury. It is a very discussion oriented school that enforces strong academic standards. Urban offers an enjoyable experience, greater than that of it's rival, University High School, and for the most part, the students at Urban are happier and better prepared for the rest of their lives. University may say that they are the better school, but everyone knows that Urban is greater in all ways."
chibi,"1)  A Japanese word meaning ""short"" or ""midget.""  The word chibi is often taken offensively when directed toward a person.  Japanese equivalent of ""shrimp"" or ""shortcake."" (language/culture)2)  A term used by anime/manga fans to referr to small and detailless characters.  ""Chibi"" characters are often used to represent a form of cuteness.  It can also be used to indicate small characters (like Chibi-Usagi/Sailor Chibi Moon in [Sailor Moon]).  (anime/manga)"
stick a fork in it,1) A state of completion. 2) To be completely destroyed or defeated.
kettling,"Oh for Christ Sake, does every word need to be a sexual inuendo? For that small audience even the most modest of social consciousness- Kettling is a tactic used by police to try to suppress peaceful demonstrations by corralling protesters and refusing to let them go."
Falkirk,"A Dead town which sucks the life out of it's inhabitants and anyone within a 500-mile radius.Over the years, Falkirk has been dominated by fat bisexual tramps who proclaim themselves as 'emos'. These creatures have invaded the town's bandstand although are easily repelled by a shiny adidas logo or two.After several one-night stands with equally bedgraggled towns such as Cumbernauld and Livingstone, Falkirk has even given birth to 10 Children referred to as 'Bonnybridge', 'Grangemouth', 'Camelon', 'Larbert', 'Stenhousemuir', 'The Braes', 'Bainsford', 'The Bogue' and '[Bo'ness]'. But we don't talk about Bo'ness. They eat their children there.The town's last scummy residents, are the pensioners. They may be found standing in ASDA on a snowy day, staring at the empty shelves and then harassing passers by. If you see a Falkirk Pensioner, Bag It, Bin it, and then pour petrol in the bin and set it alight.Falkirk is [Shite]. End of."
thick thighs,"thighs that are not fat, yet have great size. allowing one to not break a chick during sex. thighs that don't usually jiggle, but a lil jiggling ain't gonna do anybody no harm."
custy,A preppy kid who gets ripped off when buying weed because they don't know their count.
church slut,"A church slut is a rare species of the female population that regularly attends church, puts up a perfect facade, fooling all those around her, and in the end, ends up jumping all the dicks in her proximity. While everyone is singing, their eyes happen to travel around the room, looking for the most compatible males. Some of these church sluts plan their outfits a month in advance, making sure that they look borderline holy/down to fuck.They usually mark their territory by taking a minimum of 5,043 pictures with random males from their church/youth group and then proudly posting their accomplishments on facebook/myspace. A rare conversation usually occurs through facebook or through the phone (text message or phone sex) to keep the suspicions from arousing. However, church sluts keep their dirty work underground. The physical activity stays to a minimum of hugs.Usually church sluts look alike, and are normally flat and attempt at exposing more skin than needed. Their hairstyles are strangely similar to the next church slut, and they always must wear five inch heels with their outfits."
sex,"Sex is the middle man to love making and fucking. It is a medium to those two definitions in which a male and female body both intertwine in different positions all leading to a males penis entering a womans vagina until extasy is reached. The same out come stands for both male on male relationships also including male on female and multiple parties as well. As well as being used as a pleasure-filled act, it is also used as a stress reliever or tension reliever. Some say sex is mearly a form of human reproduction when in reality, we are the only species who have sex sheerly for pleasure purposes. If sex is not pleserable it is not sex, it is then a waste of time."
beat down,The act of receiving a serious butt whoopin at the hands of a person or group of persons.
SUNFIRE,"Recently came across these innacurate definitions for Sunfire. I can tell you and prove to you they are false and these two shitbags never owned one. In fact, I bet they never even drove one considering the false reviews. One of the shitbags Im referring to here is 'Kev'.His definition is probably the most fake pile of bullshit ever.Truth: Yes this car has been discontinued but for the price you cant go wrong. I owned one for years now and I never once had a problem with it.Lie: 'Piece of crap car to attract students with little or no money'- I had to laugh at this one. When I bought this car I had over 200,000 dollars in cash at age 22. I still bought it. Not only that but I also have an expensive import and a japanese car.Another Lie: breaks down on a regular basis- couldnt be further from the truth, mine never broke down. I wonder where he's getting his judgements & information from. Since he never owned one or did he? How much do you want to bet he couldnt afford it and hes making up fake definitions?12-15000 and yes thats correct and I payed for mine in cash.Lie: After insurance and repair bills it will end up costing them more than if they bought a well manufactured car. WRONG, so far I never spent hardly anything on repairs, never once had a problem with it and the insurance was great.Stupidity: 'If you own one sell it to your enemy'- I will sell it to one of the people who keep begging me for it since they see what a reliable sporty car it is and all want it for themselves and i'll be comforted in the fact there will be no problems with it.Kev, if your definition is accurate why is the richest kid in town driving one? Plus 2 other cars. I think somebodys jealous."
nooice,interj. Used to commend another's skill; largely synonymous with 'epic' or 'awesome'. Particularly suitable for use when viewing breakdancing performances. (Saying 'nooice' to commend someone else saying 'nooice' remains controversial but may lead to a heartfelt scenario.) Popularized through social media following its showcasing in a sketch on the television show Key & Peele.
godspeed,Success or good fortune.
you can't have your cake and eat it too,"This phrase is easier to understand if it is read as ""You can't eat your cake, and have it too"". Obviously once you've eaten your cake, you won't have it any more. Used for expressing the impossibility of having something both ways, if those two ways conflict."
B.I.G,The Late Great rapper The Notorious B.I.G
orlando bloom,"English actor, notable for having absolutely no acting ability at all. Has appeared in two of the most famous film franchises of recent times, and has contributed more to ruining the suspension of disbelief in these films than any number of white Volkswagens seen driving in the background."
rebel,someone who exhibits in great independence in thought and action
Skrillex,"from the Latin root word ""skrillisus"" meaning ""Homosexual Satan Wasp"""
acacia,Acacia originates from a style of tree that bugs and other things can't get into. Often used to describe something or someone that is uncorruptable.
freaky deaky,"To be in a heightened state of sexual arousal and performing strange, extreme, or unusual sexual acts."
ba-donka-donk,"A large and shapely female behind, especially one that bounces or jiggles.Popularized by Tracy Morgan's Spoonie Love character on Comedy Central's prank-call show ""Crank Yankers."""
Freedom Fighter,"Depending on your viewpoint, either a hero or a terrorist."
Rachael,"A sporty, sexy girl who is always happy and laughing. She is great at telling jokes and making others laugh. She is also very gymnastic. She is friends with everyone and has one true best friend. She can sometimes fight with friends, but no person who knows her can ever, ever hate her. She is beautiful from every perspective.Also, it's the correct way to spell the name."
ditch,"to ditch means to be left or abandoned by your gurlfriend or boyfriend. They leave/abandon u because either;a. they are bored of youb. they think its a nicer way to break upc. they are avoiding you because of something bad they didd. they hate you and never want to see you againe. they found someone better than youf. they are immensely annoyed of you and want to spend time with other peopleg. they want ""SPACE"" from youall these reasons can lead to major breakdowns for the person being ditched. also they may feel unloved, uncared for and unwanted.they can feel depressed, sad or upset. they will also say plenty of stupid things that they don't mean. if the person being ""ditched"" is very sensitive then it can lead to a bigger fight, especially if BOTH the people in the relationship is sensitive to not being treated properly. they are getting upset because they cannot stand being witout their gurlfriend/boyfriend for a long time. they might love each other very much, but both people hav to agree on the relationship for it to work.overall being ditched isnt a good feeling but it happens to everyone at least once in life. it might feel like the end of the world..but you never knohold strong and it will work out (:"
give'r,"Function:  VerbEtymology:  Canadian, particular to rural areas, especially Lanark County Ontario and most of Alberta; An amalgam of the words [give] and [her]; made popular by movie ""FUBAR""1. Going all out and/or balls to the wall to take care of business as quickly and as awesomely as possible2. Acting in a way that is like you're rocking out really hard, but at the same time, trying to solve a problem that may or may not involve drop-kicking something without hesitation"
norks,"Boobies, breasticles, breasts, tits, puppies, gazongas, babylons, call them what you will, and I personally have a great pair.Should have renamed 'em years ago as NORKS! HOORAY FOR BOOBIES!"
XIV,"14 - Norte -Norteño-Nuestra Familia.  Primary color, Red. Started in the prisons in California, it is now made its way throughout the Southwest. Mortal enemy XIII-13-Sur-Sureño-La Eme""The Mexican Mafia"" Primary color, Blue.Bottom Line: We are all brown, and the sooner we all figure that all, the better off we'll all be.  "
Harry,"An Extremely hot male who has the best personality ever! Is very versatile, a good kisser, extremely attractive and lovable. Very Cuddly and popular. Cute, adorable and loving, he will always steal your heart. Very strong and loves to have a good time."
snowmobile,grabbing her by the wrists while she is on her stomach and you are hittin it from the back
submissive,"Grey's bitch. The one from 50 shades of grey, to be specific."
immortal technique,"a very intelligent, concerned, and nonetheless dope MC..roams the underground with a take no prisoners, no-bullshit, in your face, style"
choke out,"transitive verb - to castigate, excoriate, to metaphorically ram your cock down someone's throat"
Pink Dolphin,An urban clothing brand geared towards skaters and hip hop fans. Has been seen being worn by Cool Kids rapper Mikey Rocks.
hungarian,"Very civilized and cultured also educated people.Have the same manners as Italians,Hungarians are very family-oriented and kind people.A proud Hungarian knows about the culture.We are the same as Italians,same looking people.People from other countries such as Canada or America consider Hungarians different just like they do Italians.Romanians just try to be Hungarians but they can't compete."
Stubborn,Someone who doesn't listen to other people's opinionts. A stubborn person always thinks he's right. Often assosiated with arrogant and acting allknowing. Its the same as [obstinate] and [koppig].
Three Cheers For Sweet Revenge,"My Chemical Romance's 2002 debut, was a particularly strident entry in that shifty genre of bands, slamming together elements of emo, hardcore, and even metal.  Rightly signed to a larger label (In this case, Reprise Records), MCR has returned in 2004 with Three Cheers For Sweet Revenge.  With the aid of production major-leaguer, Howard Benson, they've edited the slightly rookie excesses of the band's first album.  This resulting in a pretty damn good relentless product.  Ghosts wander in this Sweet Revenge, and the blood-stained lovers on it's cover are no joke.  "".....Throttle the ignition, Would I die for you, Well here's you answer in spades.....Got you in my sights"", singer Gerard Way wails in Hang 'Em High.  There is also a cinematic concepting here - The story of a man, a woman, and the corpses of a thousand evil men... the liners intone.  You Know What They Do To Guys Like Us In Prison begins, ""In the middle of a gunfight, in the center of a restaurant, they say come with your arms raised high"".  The cut is claustrophobic, messy, and juiced with adrenaline, like the Tokyo crime caper shootout, it was probably inspired by.  Picture antiheroes leaping sideways with twin pistols blaring - in slow motion of course - and you've almost got it.  Put an old ""At the drive - in"" record in the background, and suddenly you're shot in the arm, and down to your last clip.  This cd combines treble - kicking production, constant hyperness, ""Get to the next note now"" instrumentation, and great thematic songwriting.  Three Cheers teams with the influences Mcr shares with their peers, but recent efforts from fellow travelers such as The Used and Thursday, don't have the same furious immediacy or coarseness that makes them so appealing.  My Chemical Romance seems to have built - in restrictive bindings that prevent them from flying off the handle quiet - loud screamo stereotyping , or odd bird stopovers into choral parts or maudlin piano.  Something Like ""Ghost Of You"" might slow the pace, but it doesn't touch the railing guitars or explosive drumming.  Album highlights include the propulsive chain shots ""Give 'Em Hell Kid"" and ""To The End"", where layers of vocals increase urgency of modernist emo.  There's no question that Three Cheers surpasses MCR's first album by a landslide.  Expect nothing but extremely amazing music from this cd. "
Santaphobia,"The fear of Santa Clause watching you sleep, breaking into your home and giving you gifts."
Winter-een-mas,"According to the brilliant guys at Ctrlaltdel-online.com, ""Winter-een-mas, in it's essence, is a holiday for gamers. It is a celebration of games and the gamers who play them. Video games allow us to do things, go places, see stuff that wecouldn't do in real life. They can be an escape from reality, a release after a long day, a fun activity with friends, or just an enjoyable way to pass time. They give us a lot of entertainment. So why shouldn'tthey be celebrated?And in the same spirit, gamers themselves are extraordinary people. There are millions of people world-wide that enjoy video games. Some are hardcore fanatics, some are casual gamers. But we are all part ofthe same community, and it's a community to be proud of.The Winter-een-mas season lasts all of January, with the actual holiday lasting seven days, January 25-31."""
Claymore,"1. A large Scottish two handed sword. Derived from the Gaelic word calidheamhmor, meaning Great Sword.2. A remote detonated mine used by the US Military."
homophobia,"A term created with intent to subtly pressure society into accepting homosexual behavior. Similar to young peers challenging one another's bravery or ""manhood"" in attempt to pressure each other to partake in daring activities."
George W. Bush,Proof of the American dream - it's true - ANYONE can become President of the United States of America.
Cabbage Ass,"The condition of having gas that leaves your anus wet, having to wipe after every fart"
Orgo,"A 15"" penis shoved up the ass of Pre-Med (or Chemistry) students repeatedly over the course of two semesters, the first semester being a reasonably gentle fucking and the second semester coming with the potential for serious gastrointestinal problems. If this does not occur, one's anal passageways are not appropriately loose to accomodate the ass reaming given by the MCAT.Short for Organic Chemistry, the study of the naming, structure, and synthesizing of carbon-based molecules. It is said that when Pre-Med students die and go to hell, they're perpetually in Orgo Lab."
doing the most,Trying way too hard to be impressive but only causing self-embarrassment.
jill-off,When Jill go down her OWN hill...
MAC DRE,"Andre ""Mac Dre"" Hicks, Mac Dre, Mac Dreezy, MD, Furl, Furly, The Owner of tha Buildin. Straight out of Vallejo makin' ill raps since '84. Influenced by ""The Mac"". Head of 'RR'(Romper Room Gang). The next Tupac of the new uprising generation of gangsta rap/rap/neo rap. Producer/Musician/Vocalist/Creator of Thizz Entertainment. The realest and illest, and definately the most influential rapper of this day. His music will live on and for decades to come. R.I.P. Mac Dre"
Chievo,Gayish form to call an [achievement] from the Xbox 360.
Vijay,This means Victory
shitting,"1. The elimination of fecal waste through one's [anus].2. The art of expelling feces from one's [anus] in a manner that exceeds the definition of ""pooping"" or ""crapping"".  3. The act of making incredulous, sometimes unbelievable statements."
Rufie,"A 'rufie' is what is known as a date rape drug. The real name of the drug(s) are Gamma Hydroxy Butyrate (GHB) and Rohypnol, which are central nervous system depressants. Because they are often colorless, tasteless, and odorless, they can be added to beverages, ingested unknowingly and used to aid drug-assisted assault (""date rape""). It is illegal to manufacture or distribute these substances for human consumption in the USA.Gamma Hydroxy Butyrate (GHB), is a central nervous system depressant which is abused for its euphoric, sedative, and anabolic (body-building) effects. Because very small amounts of GHB are found in the human body, GHB is often billed as a natural supplement. It was widely available over-the-counter in health food stores during the 1980s, until 1992 when it was made illegal in the USA.Rohypnol, a trade name for Flunitrazepam, belongs to a class of drugs known as benzodiazepines — the same drug family as Valium, Halcyon, and Xanax. Rohypnol is significantly stronger than the other drugs in this family. Rohypnol is sold in both Europe and Latin America as a sleep aid, but is illegal in the USA.GHB is also known as easy lay, G, Georgia Home Boy, gamma-oh, liquid ecstasy, liquid E, liquid X (Note: GHB is not Ecstasy), GBH or Grievous Bodily Harm, Organic Quaalude, scoop.GBL and BD, are substitutes for GHB. Street or slang names include blue nitro, firewater, invigorate, revivarant, renewtrient, revitalize Plus, somato pro, thunder nectar, and verv.Rohypnol is also known as circles, the date rape drug, the forget pill, La Rocha, Mexican valium, R-2, rib, roachies, roofies, roofenol, rophies, roche (pronounced roe-shay), and rope.GHB can be produced as a clear liquid (which has a salty taste but no smell), a white powder, or a tablet or capsule. It is most commonly used as a liquid - which is packaged in a small, clear, plastic bottle - and taken orally by the capful. Powder use is on the rise — typically dissolved in a beverage.Rohypnol comes as a pill, in one and two milligram doses that is taken orally or dissolved in liquid. The tablets are often white with a line across one side, and a number ""1"" or ""2"" inside a circle and the name 'Roche.' It is frequently used in combination with alcohol, and sometimes with other drugs such as marijuana, cocaine, and heroin (to either accentuate the 'high' or help the user 'come down' from these drugs).Both GHB and Rohypnol are inexpensive, which has made them increasingly popular with younger users.The effects of GHB and Rohypnol follow a similar pattern. GHB takes effect within 10-20 minutes, but doesn't peak for almost an hour. Rohypnol begins to take effect within a half-hour, but does not peak for almost two hours. Both drugs initially cause a feeling of intoxication similar to alcohol (the user feels relaxed, sociable, and uninhibited), followed by a feeling of drowsiness. The effects can last from four to 24 hours. Higher doses can lead to seizures or coma. Combining use with other drugs such as alcohol can result in nausea and breathing difficulties. GHB and two similar substances, gamma butyrolactone (GBL) and 1,4 butanediol (BD) have been linked to poisonings, overdoses, date rapes, and deaths.The long-term effects of GHB use are not known. However, since it is made from industrial chemicals, there is a risk of severe burns to the mouth, throat, and stomach from GHB that has been improperly produced. GHB may produce withdrawal effects among users coming down from the drugs effects, including insomnia, anxiety, tremors, and sweating.Rohypnol is both physically and psychologically addictive. Withdrawal symptoms peak three to five days after use, and include extreme anxiety, muscle pain, headache, hallucinations, and seizures. Some withdrawal symptoms, including cardiovascular collapse, can be fatal.Both GHB and Rohypnol present a serious overdose threat. Since they are depressants, both drugs can be fatal when mixed with alcohol. GHB is especially dangerous because its peak effect is delayed and users often take another dose thinking they haven't taken enough (and GHB can be fatal on its own). GHB is also risky because the strength can vary by batch. Symptoms of overdose can include intense drowsiness, unconsciousness, coma, muscle spasms, disorientation, vomiting, and slowed or stopped breathing. Fatalities usually occur from respiratory failure.Both GHB and Rohypnol have a reputation as date rape drugs. These drugs are easily slipped into someone's drink (GHB is usually a liquid, and Rohypnol dissolves quickly), making the victim easily persuaded and physically weak, or entirely unconscious, leaving them vulnerable to rape, assault, or burglary. Rohypnol is especially dangerous because it causes black-outs, so the victim may have no memory of what happened to him or her."
Black Republican ,An oxymoron. What visible minority would vote for a party that only cares about rich white men?
crentist,A really good dentist who has a special quick-dry bonding for emergency crown repair. 
Anderson Silva,"Nouns:1) A Brazilian Mixed Martial Arts master currently fighting for the UFC. Nicknamed ""The Spider"" for no discernible reason other than it looks cool on t-shirts.2) Current UFC-Pride FC Middleweight champion.Verbs:1) To kick everyones' asses so monstrously that you intentionally gain weight so you can fight people larger than you.2) To Fuck someone's shit up in five minutes or less."
Madi,"Madi: Mostly a girl, occasionally a guy... Or a girl in disguise, up to you, really. Not really one to mess and refuses to follow the rules... But can be a real bitch. If you see a Madi, you go 'Oh holy shit, you'd better hope she likes you.'And then run if she doesn't."
Of Mice and Men,"Fantastic Novel by American Writer [John Steinbeck]Featuring the story of two migrant workers in California ,George and Lennie,Has a Tragic Ending.Some American States have Banned this Novel using the excuse it promotes euthanasia (Sounds like Nazi book Burning to me)!"
Dominique,"common name for a girl, for example, Dominique Dixon. The name literally means ""of God"", hence, a blessing, an angel. Though not all girls named Dominique are angels, not all are temptresses or evil either. Very hard to define seeing as they are all diffrent and unique and beautiful in her own way.Note: Dominique is a female french name, Dominic is an americanized male name, derived from the female name, Dominique is not a male name, though it is used as one, but hell a tomatoes a fruit, but its used as a vegtable, shit happens"
