word,definition
drum and bass,"Drum and Bass is a form of electronic (but now in some places, performed with live instruments) music that is played between 160 to 180 beats per minute (bpm). It is a melting pot of diferent musical influences ranging from classical, hip-hop, reggae, jazz, to indian, metal, and so on. Some tunes have vocals and are song structured, but other tunes are straight beats (which let you form your own perception of the track with your imagination). Defined by music production publications as ""the most meticulously produced form of electronic music"". Drum and Bass has a beautiful contrast in that it can have mass complexity while still maintaining a friendly feel to the dancefloor or the personal cd player. Drum and Bass is also the umbrella term for the genre that has developed countless subgenre's (neurofunk, techstep, hardstep, ragga, jump-up, liquid funk, atmospheric, dubwise, electrostep, metalstep, etc.). To those who don't know much about the music, they would be surprised how much it has in common with the genres that the unknowing listener usualy listens to. It is an open minded genre that requires open minded people to listen to it."
q-tip,"a person of much older age (60-80s) that still are some what capable of driving, all you can see is there little old white hairs creeping over the steering wheel."
Nothing,"   Nothing was once questioned by a great mind. Is it the ""prescense of abscence or the abscense of prescense""? Furthermore, what is the sound of one hand clapping? What is out there in the universe, at what makes up those vast spaces of abscense? (or prescense of abscense)    Nothing, put simply, is the deepest, shallowest, brightest, darkest, widest, thinnest, and incomprehensibly empty emptyness, so empty that it is only prevented from collapsing upon itself because there is no substance to collapsae in upon, or no substance to do the collapsing, or even any substance to think or daydream about collapsing upon abscense of prescense or prescense of abscense, which is still utterly and completely absent of form and shape and mass and prescense that is abscent from the existance of anything. In short, nothing is the total, absolute, final, and complete spot that is both positive and negative, young and old, and to sum it all up the opposite of everything in existance, for there is no existance in nothingness. It has even been thought that nothingness itself doesn't even exist, and that the existance of nothingness is so impossibly ludicrous and isnane that if anyone were to actually realize or see nothingness, the entirety of the expanse of the Everything would simply vaporize, leaving even more nothingness in its place.    Nothingness is nothing, to put it simply. (really, this time)"
clowned,putting oneself in a position where you are open to ridiculealso: clowning; to bring ridicule upon someone
procrastination,"Procrastination is a lot like Masturbation. It seems like a good idea at the time, but in the end you're really only fucking yourself."
Slombie,"A Slombie is a hand made patchwork zombie doll created by www.facebook.com/TheCrumbDiaries a mom and son team, Al & Logan. ""Slombie"" is ""Loganese"" for Zombie."
doobie,a marijuana cigarette
the hunger games,"truly fantastic book by suzanne collins, set in the future. heroine katniss everdeen takes her sister prim's place in being chocsen by the cruel and sadistic Capital, to participate in the hunger games, a fight to the death between two teenagers from each of the 13 ""districts"". the last survivor is the winner, and there can only be 1 winner. she is joined by Peeta,the bakers son in her ""district"". Lionsgate films have bought the rights to make a movie."
IBRAHIM,"On a scale of 1 to 10, hes a 14 of awesomeness. Hes by far the best DOTA player known, and coolest arab in the world. Matt, Muhammad, Ramzi, Red, and Niel aren't half the dota player he is. Also very cool."
Phat rabbit,another name for a juicy large vagina.
hiptop,"Sidekick; mobile device that allows user to access email, web, chat, and phone all from the hip.  Used by really cool people such as professional athletes, rappers, drug dealers, and kids that like to emulate this particular lifestyle."
beta,"A beta version of a program, game etc... is an unfinished version released to either the public a select few or whoever signs up to beta test it for bugs or glitches. A common mistake people make when talking about for exampl 'Msn beta' is they say 'better' instead of beta."
boobs,Definitely larger and more classy than tits. 
scratch,"to engage in a sexual act with, most commonly intercourse"
faggot,"1. A bundle of sticks.2. [British] term for a cigarette.3. An insulting term for a [gay] male, usually used by insecure straight males of the teenage persuasion to ""show that they are not gay"". Still, used among gay men, ""faggot"" is sometimes a term of affection/badge of pride, but it is still a loaded word."
dodgy,"An emoticon overly used on PBNation. Ususally used to show sarcasm, it is now used for anything and as become exetremely annoying."
synthesizer,An electronic musical instrument that can generate it's own sounds. Not to be confused with [sampler].
mohamed,The coolest kid in Valley Stream
Leonor,"Leonor is beautiful on the inside and out. She's generous, kind, friendly, intelligent, caring, funny and posseds many other desirable qualities. Leonor comes from ""Leo""; ""Lion"", which can also be translated as ""freedom"" and ""fire"". No one is perfect, but Leonor is closer than anyone of being it."
Short Stack,"an awesome Australian pop punk band formed in 2005. Band members include Shaun Diviney (lead vocals, guitar), Andrew Clemmensen (backing vocals, bass) and Bradie Webb (drums, keys). They are extremley epic, have awesome hair, and have an extrodinary musicalal talent. Just because most people are into techno and rap doesnt mean they suck. And theyre hot and have never been rude to their fans. and would be even awesomer if they came to my hometown. True vibers tbh."
jarren,"A really atractive afican american who is a good dresser, scholar, writer and man. This person is usually around the ages of 16 28."
John Watson,gay for Sherlock Holmes.
something else,"Someone or something that cannot be described in words. It's not a good thing, but a great one."
craigslist bodyguard,"Someone (usually a friend) who accompanies you to an in-person meeting arranged via Craigslist to provide support in case of anything going wrong (ex: the Craigslist person being dangerous, creepy, or a scammer). The Craigslist Bodyguard can also simply provide moral support or transportation."
demitri martin,"hillarious comedian with best poker face.  mediocre guitar player, but has hella funny jokes"
whatthefuck@us.army.mil,"A phrase used by soldiers to express displeasure with Army regulations, chain of command, piss poor planning, etc."
x1,"1. v. (to x1) to find something on your computer2. v. (to x1 someone) to prove to someone that an email or file exists3. v. (to get x1'd) to have someone else show that you did indeed actually get a specific email.4. n. (X1) a desktop search product that lets you search the emails and files on your computer and across your network at speeds matching the original Bell X-1, the first plane to break the speed of sound."
Beatles,"A rock and roll band started in early 1960's Liverpool, England.  Originally comprised of [John Lennon], [Paul McCartney], [George Harrison], Stu Sutcliffe (who died in Hanburg, Germany in the early 1960s), and Pete Best (who was ousted from the band); gained fame as John, Paul, George, and [Ringo Starr].  Appeared in America in February, 1964 on the Ed Sullivan Show as the beginning of the [British Invasion].  Initially managed by Brian Epstein, who died in the late 1960s.  Broke up in 1970 but during their tenure as an act released some 150 songs in multiple languages and has since been considered the greatest and most influential rock band in the history of the world."
Womanizer,"A guy who will make you believe he has a thing for you. He'll compliment you all the time,Flirt call it what you want, but he only wants sex. Also talks to 656,729,860 at the same time thinking your not aware. He ain't no slick rick"
PatsFanTx,A troll loser who is in love with Cindy Brady and spends his days bashing the NY Jets.
Ronan,cool customer never panics cool under presssure
Lord Of The Rings,1) A book.2) A damn good movie.3) An excuse to skip school.4) A way of seeing Liv Tyler without having to download mass amounts of fake porn.
Stephaniè,"A diamond in the rough, really does not know what she's worth or someone just has not really shown her yet. Her beauty lies not only in her looks but most importantly in her heart."
black power,Racist term chanted by black supremacists who desire the destruction of a particular society.
Curse of Oil,"When oil money makes the citizens of a country complacent, laid-back, and uncreative—foreigners instead of locals often run their country."
ABG,"Acronym for Asian Baby Girl. Asian gangsta girl who likes to hang out with Asian b-boys and parties all night long. Puts a lot of makeup on and is usually a slut. Have teased hair and also die their hair often. Fake eyelashes and thick eyeshadow is also relatively common. Are stereotypically hot and wear revealing clothing. Like to make out with their boyfriends and jump on girls who talk crap about them. Most Asian girls do not appreciate being called an ""ABG""."
PvP,"A player of a game fighting against another player.Any number of people can participate in PvP, and it does not have to be a fair situation."
abuse,To use something excessively.
god of war,"like the greatest ps2 game of all time with good graphics, awesome gameplay, and lots of blood and guts.  BUY THIS GAME."
dopeness,"Adjective used to describe the niceness, or awesomeness of a person, place or a thing."
A bitch,Chris Newton
Gabriel Iglesias,"A comedian who's claim to fame is his five (now six) levels of obesity: big, healthy, fleshy, fluffy, DAMN! (and HELLLL NO!) His entire routine is a riot, filled with sound effects and personal stories that are touching and hilarious. Very few comedians today can make you feel connected to them by the end."
Jefferson Nutcracker,When a guy puts his cock in a woman's ass so hard she grabs his balls and cracks them.
Megan,"Megan is a girl that no matter how hard you try you can't stop thinking about her. Whether you spoke to her yesterday or 3 years ago you still think about her everyday!She is somebody that can make you laugh uncontrollably, somebody who can make you want to be yourself around her and somebody who can change your world without even trying... She is a gift, something that shouldn't be taken for granted, something that you will forever hold dear to you because you got to know her and who she really is! She is the perfect woman! The person you dream about, the girl you'll think about before you go to sleep, and the person you'll think about when you wake up! But you won't be the lucky person who gets to talk to every morning, and you won't get to say goodnight?!?If you ever find yourself lucky enough to know a Megan, then tell her everyday how beautiful, genuine and amazing she is. Cause one day she will be gone and all you'll have left is memories.Don't you wish you had of done and said more to Megan!"
Billy Joe Armstrong,What idiots call Billie Joe Armstrong.
interior design,"A profession that everyone thinks they know something about, when in reality, is very technical and requires extensive knowledge of history, fashion, architecture, building codes, art, and the basic principles and elements of design. Practiced by an ""interior designer,"" or ""designer,"" for short.  "
OverLord,Used contemptuously.  Discredited and/or disgruntled eBay sellers generating artificial traffic spikes for Overstock.com as they return to the site again and again in vain hope of a sold listing.
masturbate,"To have sexual intercourse alone. Males usually look at porn while doing this. Take 1 hand put it on the shaft of the penis. rub it up and down until it gets at its full potential. slowly increase your speed until you cant stop. it feels so good and no worries about pregnancy im pretty sure everyone does it sometime during every day.(i know i do)after beating it for a minute or a few you will reach the climax and ejaculate all over. the more you do it the farther you will shoot :D then your penis head becomes very sensative after you shot. Then you quickly turn off your porn, put your clothes back on and act like nothing happened. girls on the other hand take more time to do this. they mostly do it when they are away from people for a long enough time. You sit down usually on a comfortable chair or couch and then u stick your middle finger inside your vagina. Or you can take a few fingers and rub the clitoris (most sensative spot) some girls like to get ready for men in their life or just dont want to risk anything so they use a dildo(a plastic penis)Girls can either bend over and give anal masturbation which feels good or stick it the vagina slowly and deep. the girl will have an orgasm and if goes long enough will also jizz (lots more)girls after masturbation feel worn out and will most likely relax for a few minutes maybe rubbing boobs or clit very slowly."
put da team on my back,"One's will to carry the team and not let any obstacle come in between... a desire you must acheive, to go head and get that green, if you not what i mean."
edward 40 hands,"A game designed to intoxicate all participants where 40oz bottles of cheap malt beverages are fastened to each hand by adhesive tapes or super-glue in some cases. The winner will have consumed all liquid in both bottles and usually celebrates by smashing the first bottle to remove it, and using the free hand to urinate into the second. Studies at the University of Colorado in Boulder conclude that the best way to be victorious in this game, without fear of urinating yourself, is to start the game with your penis already un-tucked,out of your pants. Ladies in the study, who opted to go in skirts without undergarments, fared well however did not ever claim a victory. "
mnbvcxzlkjhgfdsapoiuytrewq,"A noun that shows boredom beyond even qwertyuiopasdfghjklzxcvbnm, most people type it into search engines, such as google, for something to do, showing that they are going insane(For the record, the asylum has been notified about you by now)"
philippines,"The Philippines is a home of family-oriented people. Also home of people who love to laugh. Wether it's war or they're having a miserable life, they'll find time to laugh. Also a home of poeple who love exotic dining such as bloatfish (which are deadly and poisonous), isaw or animal intestines, balut or slightly-matured duck eggs and many more.AND, the pople in the Philippines are very hygenic. Except maybe people living in squatters' area. But it's not often that you visit a country where people take a bath once or twice a day and some even three times. And, they use pails and water rather than tissue paper because it is much CLEANER. Using water is MUCH cleaner rather than using tissue paper becaused more bacteria is left and you cannot clean thoroughly. "
skully eyed,Eye socket region has so little fat that her face looks like a skull or a corpse.
France,"1) A Western European nation. Located slightly beneath Britain, in most or all senses.2) Produces nice wine. 3) Produces nice cheese.4) Produces shedloads of nuclear weapons, which are happily tested on small Pacific atolls home to endangered species of fish and pygmies.5) The number one source of irritation for the rest of Europe. This manages to go unnoticed by many Americans, who assume the continent is a single amorphous blob.6) Also the number one source of contention for the United States, having replaced the Soviet Union. 7) Has an annoying accent.8) Dislikes British beef. This, as theory and experiment have shown, is due to France's argumentative and overly vegetarian wussiness and has nothing whatsoever to do with life-threatening brain disease.9) Dislikes Germany, for invading it repeatedly and being German.10) Dislikes Britain for constant warfare, political disagreement and out of habit.11) Dislikes the United States for its competition in the 'irritating accents' league table and also for having more nuclear weapons and cheese than France. 12) Dislikes.... well, most things, actually. 13) Is a thoroughly splendid country.14) Is filled with thoroughly un-splendid French people."
pocket poop,"A synonym for shirt shart. In a jam, ripping off your shirt pocket and using it to wipe when no toilet paper is to be found."
Abdiel,"Abdiel is a name that refers to an extremely hot guy that is usually very popular among girls. He is somewhat smart and usually a trouble maker. He is also a class clown. He likes to hug and is good at it. He has a special hug just for that special girl. When a girl falls for him, they'll do anything to get his attention. Sometimes this includes stalking. Abdiel is overall a hottie with great personality."
tucson,"A metropolis in Arizona which is populated mainly by retirees, students, and people taking the long road to nowhere. General employment is limited to franchise restaurants that pay bare minimum wage. ""Sites"" to see include pharmacies, golf courses and tiny strip malls that were built in the last 10 years. Oh yes, there is also some pretty geography, but could be seen in the comfort of your own home - on a postcard."
Grayson Dolan,He's a stunning vine famous teen who has a jawline sharper then the knives in my kitchen.
conservapedia,"A fundamentalist Christian wiki encyclopaedia project which promotes Biblical creation and rejects science. Heavily criticised by both conservatives and liberals, it is the subject of ridicule from those who are used to getting information without a heavy dose of fundamentalist hilarity."
housin,v. 1. An act or a showing of dominace.n. 2. A word to explain what one is doing at any given time (See [chilling])
BUSH,"One whom spends American tax dollars on creating bombs for unnecessary wars, killing millions of innocent people..."
Edward Cullen,"Here are the massive flaws of the vampire, Edward, in Stephenie Meyer's Twilight series. And yes. I hate the book. Completely stupid thing to fill your minds up with.1. He's so darn overprotective of Bella that sometimes i want to strangle him. ""I won't let you go over the the werewolf pack cuz you might get hurt by the other guy who loves you."" Completely valid reason, Edward.2. EDWARD'S FRICKEN INK ON PAPER, GIRLS, YOU CANNOT POSSIBLY TELL ME HE'S GORGOUS. NO!!! DON'T DROOL ON YOUR SO-CALLED ""BIBLE"" OVER A COUPLE OF INK SPLOTS! AGH, THAT'S DISGUSTING!!! 3. He hates Jacob. Well, i hate Jacob, too, but still. I thought he was PERFECTION, girls, so he can't hate anybody!!! For a couple of reaons: 1, Jacob's in love with Bella..(i thought jacob had better taste than BELLA...?) I don't blame Eddy for that. Okay, secondly, he's jealous. WHAT'S THAT, DROOLING FANGIRLS!? I THOUGHT HE WAS ""PERFECTION""!!! And thirdly, he hates werewolves because he's predejuced. OMG! LOOKS LIKE EDWARD ISN'T PERFECTION!!! who knew?"
Ted Mosby,"1. The main character on HIMYM. While Ted is sweet, awesome, and romantic, he can also be rather douchey (and that's douchey, not douché) as a reflection of his personality in college. His main goal during his late 20s and early 30s is to find a wife, and he pursues many ill-fated relationships to fulfill this goal.2. A man whose life is way too focussed on getting married and having children.3. A noted fictional porn star, sex architect, and philanderer described in tedmosbyisajerkcom"
Hufflepuff,Founded by Helga Hufflepuff.One of the four 'houses' at [Hogwarts].Usually consists of the most friendly and hard-working students.Their mascot is the badger.
normal,An adjective used by boring people to make themselves feel better.
Stellard,Totally intoxicated and anxious to pick a fight with anyoneFrom the lager brand Stella Artois
Pirates,"Pirates are a sea fearing folk, oft to be seen pilaging, raping, murdering, or commiting other acts of piracy. They usually own a monkey, parrot, or sexy wench."
Royal Marines,"The Amphibious Fighting Force of the United Kingdom.Created in 1664 now amongst the top two Regiments of the United Kingdom (the other being its rival the Parachute Regiment). Far superior to the US Marine Corps, in that they are Commandos, having completed 32 Weeks of basic training, with a 30 Mile Speed march in 8 Hours (7 Hours for Officers) and other tests of physical endurance.They come under the command of the Royal Navy, and have in their history been rewarded with 10 Victoria Crosses. "
Tom Fulp,Creator of the popular flash cartoon portal [Newgrounds]. Brother of [Wade Fulp].
Emma Watson,"Emma Watson is a 16 year old british brat. The only films she has been in are the Harry Potter series in which she is portraying herself. She claims her hair is ""naturally"" blonde even though her eyebrows are darker than a black cat. She likes to make stupid poses and faces during interviews and public appearences. Emma thinks Hermione is supposed to be the star of the Harry Potter series and is jealous of the attention Daniel Radcliffe and Rupert Grint recieve. She likes to pretend her hair is brown and frizzy like her character in harry potter but she is really portraying herself. Emma likes to bitch at people on set and roll her eyes during long interviews when asked the same questions more than once. She also is very fond of screwing up Hermione's character in the harry potter movies by wearing massive amounts of pink (including the yule ball dress which should have been blue), stealing characters lines, punching (instead of slapping) draco malfoy, and curling her hair. Emma also is fond of alcohol, considering the amount of candid photos we have seen with her drinking a corona beer (The drinking age in the U.K. is 18, emma is 16). Her fans consist of pre-teen girls who love Hilary Duff, wear training bras, tYpE LyKe DisSs!!1!1!!!111!!eleventy!!1one!! and 11 year old boys who secretly steal their mothers victorias secret catalogue. Emma Watson is europe's biggest child celebrity idiot."
Albiotard,"A type of mountain bike rider that frequents Albion ""Hills"" trail system near Toronto, Canada, that believes all trails should be sanitized for beginner riders and boring for experienced riders by removing obstacles or advanced features on trails making it easier to ride.."
dirty twerk,when a girl in a short skirt is twerking a guy and intentionally sharts on the guy's junkhood...
democrat,"one of the two major political parties apparently dedicated in removing rights givin to man by god, completely ignorant to what the founding fathers believed in, and utterly desperate to take the political power from the people and hand it to an increasingly powerful government. Also convinced their opinion is the absolute truth and that republicans are evil for holding their own."
True Blood,Great HBO show based on Charlaine Harris's Sookie Stackhouse novels.True Blood makes Twlight look like shit and not to mention all the hot sex on the show. Twlight is the pussy version of True Blood.  
Sheila,"1-A sheila is a worshiping word for a beatiful mysterious woman that one of your mates knows on a first name basis, but you have never met.2- a possessive term used for ones girl, lover, or CSP"
guero,"Pronounced ""where-oh"", the sometimes-derogatory term is slang for a fair-skinned or fair-haired male; the Spanish equivalent of ""[whitey]""; also the title of eclectic musician [Beck]'s 2005 album"
barista,"1) A person trained in the art of preparing and serving espresso. 2) Anyone who prepares and serves coffee products in a coffee shop.(Italian for ""bartender."")"
safiya,an awesomely awesome person who..-has great style-has an awesome personality-an incredibly hot girl-wants fries from mickeydees at NINE in the morning.loser.
mind rape,"Mind rape occurs whenever one's brain feels as though it has been assaulted viciously by some event or thing in reality. People are particularly susceptible to mind rape if they are on almost any kind of illicit substance (ie, LSD)."
some sort of idiot,for use when not sure which type of idiot the accused is.
live,"Jumping, full of people, exciting. Something was very enjoyable"
Dulaney High School,In Baltimore County if you get kicked out of private school or didn’t get in to private school or just didn’t feel like going to private school and you live in Baltimore County then you go the closet thing to a coed private school and that’s Dulaney High school. All the guys and girls are really preppy and have money. The guys drive lifted jeeps and the girls drive 4 runners with roxy stickers in the back window. If you’re a guy and you want to have any kind of fun you have to play lacrosse. If you’re a girl and you want to have any fun you better get a boyfriend on the guys on lacrosse team.
pt,Physical Training
kthxbai,"Variation of 'kthxbye' - the internet bastardization of ""OK, thank you, goodbye"".Generally used with contempt, or for hasty exit.  See also - kthxbye"
lunatic,crazy or psychotic person
mooninite,"Two dimensional creatures that hail from the inner core of the moon. They are arrogant, are often bad influences on those who come in contact with them, and have the ability to shoot large square like projectiles from their moon weapons.They can be seen on the Adult Swim show [Aqua Teen Hunger Force].Mooninites launched an attack on Earth in January 2007. They succeeded in shutting down Boston on Wednesday, January 31."
