word,definition
scouse,"Scouse, or scouser.Term for people originating in Liverpool (UK) or their accent/dialect.  Used as a positive, neutral or derogaratory word depending on  the speakers prejudices about said city.It is part of a genre of slang terms which refer to people by stereotypes of their dietary habits.  (Such as [pom], [limey] or [ros bif] for the British.The meal scouse was common in working class Liverpool in the past, and is a thick stew of lamb and vegetables, slow cooked in a pan to make cheap cuts of meat more palatable.  For the very poor you could make do with 'blind scouse' which is a lamb stew with the lamb left out.The older origin of the word is probably from the old Norse word 'skaus' again for a type of stew."
Breanna,"1. A different spelling of the name ""Brianna"".  From the Irish name ""Brian"", but the female version.2. The classic ""bitch""  character in preteen-teen movies.3. A jock, a typically dark brown haired girl who is attractive, but kind of stupid and sorta mean.4. An earthy creative individual, easy to talk to, compassionate- however overly nice at times, to hide real feelings.  Commonly has an abnormally close guy friend and is known for making bad decisions with guys... who frequently turn out to have some odd sexual preference.  She also has NO gaydar.  She also tends to date guys/girls with rhyming names.5. The nice waitress at Applebee's... yeah the one that smiled at you that one time."
:/,"The act of being:1) Unsure2) Sarcasm3) ""Yeah sure."""
Pocky,"Pocky is a Japanese snack food produced by the Ezaki Glico Company of Japan. It was first sold in 1965, under the name Chocoteck, and consists of a biscuit stick coated with chocolate. Pocky was an instant hit among Japanese teenagers, and brought in sales of 30 billion yen in its first two years. The name was changed to ""Pocky"", after the Japanese onomatopoetic word for the sound Pocky makes when bitten, pokkin. The original was followed by ""Almond Pocky"" in 1971, with an almond coating, and ""Strawberry Pocky"" in 1977. Today, the product line includes such variations as milk, mousse, green tea and coconut flavored coatings, and themed products such as ""Decorer Pocky"", with colorful decorative stripes in the coating, and ""Men's Pocky"", a dark (bittersweet) chocolate and ""mature"" version.Pocky is very popular in Japan. In bars, it is sometimes served in a glass of ice water. It also has a significant presence in other East Asian countries such as China and Korea. In Europe, Pocky is renamed Mikado after the game Mikado. In the United States and Canada, Pocky can be found in Asian supermarkets and the international section of most large supermarkets, as well as Wal-Mart Supercenters and anime convention dealers' rooms. In Malaysia, Pocky was renamed by the Glico Company as Rocky, perhaps to avoid a vulgar word in Malay with similar pronunciation. Pocky has recently been marketed in America by LU, a company of the Danone Group.Outside of Japan, Pocky is fairly popular among Japanophiles and otaku (anime fans). Its constant association with the Engrish phenomenon and the oddness of some of its versions (like the ""Men's Pocky"" bittersweet flavor), as well as the several Pocky parodies seen on many anime/manga series, contribute to the snack's reputation."
Zone 6,"Zone 6 is a zone that covers the Eastside of Atlanta.Its full name is Atlanta Patrol Zone 6.Areas, hoods and roads in Zone 6 include:- Bouldercrest- Candler Park- East Atlanta- Eastland Heights- Edgewood- Flat Shoals Ave.- Glenwood Dr.- Kirkwood- Memorial Dr.- Mountain Park- Sun Valley... plus others."
Shane,"A very hott boy, that has a nice body. Always smells extremely good and is all gangsta."
Trevon,"A person,, BOYwho looks like and Arab but is a mixed peron with [PRETTY] EYES and [cute] hair a person who smokes alot of [weed]. has alot of [swag] and all the girls love him he has [HOES] ON HIS [DICK]:)!"
"olfactory ""hallucinations""",When you smell something that really isn't there.
moss,to relax or chill.  the act of chilling. 
Dram,A pour of alcohol. The amount is determined only by the generosity of the pourer.
smarterchild,An aim (aol instant messager bot) that is smart and cares about your feelings to boot!
cunning,"A word to describe someone or sometimes something thats tricky, devious, sly or shady"
intellectual,Someone who has found something more interesting than sex and alcohol.
parachute,"Ingesting a powdered substance, usually a crushed up pill, by wrapping it in some toilet paper and swallowing it."
fuck this shit,What people say when they give up at something out of frustration
Lightweight,Someone who has a low tolerance or stamina in a certain situation.  
BMW,"Cocktail made from Bailys, Malibu and Whiskey."
Glo'd Up,When a person got much more attractive over time. Usually compared between before and after puberty.
democracy,Four wolves and one lamb voting on lunch.
Rock out with my cock out,A term used when a person has plans to do really good at something they really like.  A bragging notion that you are going to be better than everyone else at the activity.
donnie,to get very high by smoking the reefer
greedy,"1. To want more and more than what you really need.2. When a ping pong game is really close, getting greedy refers to taking huge risks in order to gain a point."
shit-kicker,1. A cowboy; called so because they muck about in manure on a fairly regular basis.2. The manure-smelly boots such that a cowboy wears.
Amedicon,"How an uneducated Italian pronounces ""American"". These fools can be found at the Jersey shore and pizzerias everywhere."
jebanje,"fucking in serbian, croatin , bosnian"
Ninja Defuse,"Of the game Call of Duty 4:When playing the gametype ""search and destroy"", a Ninja Defuse consists of sneaking up behind the member of the attacking team who is planting the bomb at either target A or B and lying in wait behind them for them to finish planting. As soon as they have done so, one begins immediately to defuse the bomb (occasionally actually pulling it from underneath them). The enemy who has just planted the bomb rarely check behind them for a ninja, so concerned are they with watching nearby corners for oncoming enemies. Most effective when all but one member from each team has been eliminated."
queer as folk,at tv show about 4 gay men and a lesbian couple that keeps me up until two in the morning on school nights. its that addicting.
How's tricks?,"As others have stated, an informal greeting meaning ""Hello, how are you?"". But the true spelling should be Trix (with a capital T) because of its origin, which no one seems to know: It was (still) an informal greeting, started in the early 20th century; but the entire phrase was ""How are Trixie and the kids?""... basically asking how one's family was doing. Trixie was short for Beatrix, or Beatrice (a popular female name of the era) and came to be known as slang for ""the wife"". Over time the phrase was shortened to simply ""How's Trix?"""
Josephine,Tiny little boy-crazy fireball with a good taste in music. Has her preferences and knows many references. Level-headed and can seem mean. But often it is to keep some at bay. Inside is a wholeheartedly nice girl; usually an excellent lover as well. Her uniqueness is what attracts others. However she'll soon show you just how awkward she can be. A real tough chick.
Jessie,Boy/girl name. Can be a boy who is a pimp. He can be cool and give opinions. Got your backCan a girl who every boy wants. Very smart and graceful.Can be wild and funny.
cap,"refers to the ignition cap at the base of a cartridge for a firearm. ""bust a cap"" means break the cap by pulling the trigger, setting off the explosion that propels the bullet"
brad pitt,"A good looking actor who does his best work when playing crazy people and/or fighters (see [Twelve Monkeys], [Fight Club] and [Snatch]). Is about to have the most beautiful baby in the world."
Psycho Ex-Wife,"An unstable woman with a terrible personality disorder who divorces you despite your efforts over more than a decade of marriage to ""save things"" for her and your children.  She then fights to keep the children away from you for no good reason and she abuses the legal system in order to do so because they favor psycho ex-wives, even to the detriment of the children and then relentless torments you even though she got most everything she set out to do... except KILL YOU... yet."
santorum,1. That frothy mixture of lube and fecal matter that is sometimes the by-product of anal sex.2. Senator Rick Santorum (R-PA)
punk,"A very  wide genre of rock started in 1977 that has a sound that has infleunced countless types of music some of which including: [streetpunk], [oi], [d-beat], [crust] [powerviolence], [pop-punk], [grind], [indie], [emo], [screamo], [hardcore], [deathrock], [77], [uk82], [glam], [hair metal], [speed metal], and even [sludge metal].It is a label that is largely misunderstoof by the public (despite what they may think) and so overused that obvious fallacies to what the style  is (fast, loud, and hard) have become accepted.  Such clearly [pop] acts like [Hilary Duff] have been labeled punk which is downright laughable."
two timing,"A form of [cheating] in a relationship where a person attempts to maintain two seperate relationships at once without one-another involved in each relationship knowing about each other.  When information is known, the offender usually openly denies anything's going on, and may accuse one person to the other that the other person involved is either obsessed with a relationship or is a [home wrecker] and, vice versa to the other person. In typical cheating on the other hand it may be a sexual relationship and, the ""on the side"" person may or may not know that the person they're having sex with is in a relationship."
Cultural appropriation,The idiotic conflation of culture with racism. Essentially the absurd belief that the cultural exchange that has served to enrich humanity throughout all of human history is wrong because racists exist.
Jesse Lacey,"The Lead Singer of Brand New;a type of God, lyric genius, emotionally expressive mastermind."
bottler,London working class slang for a coward.
dumpids,"adjective; horrible, creepy, very bad. Can also mean sketchy or ugly."
lockdown,"1. The act of someone controlling somebody, especially when their's no commitment involved, so that somebody cannot move forth nor make up it's own mind, while letting that someone have it's way. 2. The act of someone controlling somebody's social life and activities. 3. The act of someone reporting it's every move to somebody. 4. Restrained from moving or acting; [check], [in check]. 5. Someone who invades somebody's privacy.6. Prison inmates confined to their cells as a security measure following a disturbance in the prison. 7. A prison, especially one that's maximum security."
Macro,"Ok the people here obviously don't know what a macro is. A macro is a funny picture with a caption in it. Usually used on forums. Macros can be made completely from scratch. Or could be just a still shot of something and someone just adds the caption in. Macro can be made from anything. Real life, Anime, Video games. Macros are just funny pictures with a caption (usually using internet speak such as ""lol wut?"") That are usually used on internet forums."
Skymall solution,"An absurdly single-purposed tool or solution which solves a problem you don't actually have. Like many products in the popular in-flight catalog, Skymall."
Stupid,niggers
DSM,"October 1985, Diamond-Star Motors (DSM) was incorporated as a joint venture of Mitsubishi Motors Corporation (MMC) and Chrysler Corporation. April 1986, ground broken for the auto assembly plant in Normal, Illinois. Construction of the 1.9 million square foot facility, with an annual production capacity of 240,000 vehicles, was completed in March 1988. Diamond-Star Motors simultaneously launched its first two mass production vehicles in September 1988: the Mitsubishi Eclipse and the Plymouth Laser. In 1989, 90,741 vehicles were produced. A second production shift and a third shift for engineering and maintenance were added in May 1989. In 1991, MMC purchased Chrysler's 50 percent share and the plant became a wholly-owned subsidiary of MMC. On July 1, 1995, Diamond-Star Motors was renamed Mitsubishi Motor Manufacturing of America, Inc. In October 1995, MMMA celebrated the one-millionth vehicle - which was the first Mitsubishi Eclipse Spyder convertible. It was also the 10th anniversary of incorporation. The plant has had three expansions since 1988; the most recent was in November 2000 when groundbreaking occurred for a 170,000 square foot expansion to Stamping and Body Shops to accommodate the new sport utility to be built at MMMA in 2003 (2004 model year ). Upon completion of this expansion, square footage will be 2.5 million. Rich Gilligan joined MMMA in December 1998 as Executive Vice President and Chief Operating Officer and began a restructuring and turnaround of plant operations. "
bum rap,"unfair blame, unjust sentence (english slang)"
jodido,"Spanish slang for ""fucked,"" from the verb joder (to fuck)."
voyeur,a person that likes to watch other people engage in sexual acts
eating out,"To [go down] on your girlfriend or wife.To cause extrem pleasure for your girlfriend or wife.The best thing a guy could do for his girlfriend or wife.An unselfish act.If done correctly, you could give your girlfriend or wife an [orgasm] or [multiple orgasms.]Some thing that takes practice.Some thing that can be fun if you give it a chance.To lick a womens clitoris, vigina lips, and vigina entrance.Can be done while fingering your girlfriend or wife."
ghost,holding in a hit so long that you don't see the smoke when the person exhales.
Kellie,"An amazing, incredibly beautiful and intelligent person, who is always there for you no matter what, who always cheers you up and treats you amazingly."
jew,1. Someone who practices Judaism.2. Derogatory term for someone tight with their money or someone not very generous.
atheist,"An atheist is a person who does not believe in any sort of deity. Though this does not neccessarily precipitate smugness, it can often lead to it. Atheists however are impossible to stereotype just as any person of any other faith is impossible to stereotype due to the wide nature of this group."
DSL,"dick sucking lips, oh yeah"
Canadian Soccer,"Canadian soccer is played all over the world.  It involves an ice rink, sticks, and 2 goals.  It is sometimes referred to as ""hockey""."
fuck sake,For [god's]sake! English or Irish derived. Usually used in a soccer game to express anger or hurt.
FPS Russia,"A KGB spy that is living in America, who posts videos on youtube that take place in his backyard showing all the guns he owns, he killed his neighbors and put blow up dolls in their houses so the cops would not be deceived"
Barrett,"Berserker warrior known for being fearless in battle; one who is fearless; one who lives to die in a way deemed gloriously; person who leads by mystique, curiosity, confusion, unmatchable uniqueness, humor, or in some cases fear"
badass,"First things first. There are very few known badasses out there.1. First of all a badass will not seek attention. Attention is something he could give a fuck less about.2. A badass doesn't speak out his ass. They are honest, and truly care about others that deserved to be cared for.3. They are typically quiet and really don't have much to say. They are usually intelligent in some way or another.4. A true badass must be able to protect his family and closest friends no matter the consequences. Though a true badass likely doesn't have many friends because he doesn't depend on them.5. A badass is loyal.6. A badass gives respect only to the people who deserve it, no matter who the fuck they are or how old they are."
pagan,"The term 'pagan' comes from the Latin word 'paganus' which means, in short, a country man. In contemporary society the word 'pagan' is an umbrella term encompassing many polytheistic earth-based religions including Asatru, [wicca], druidry and hereditary witchcraft.Most pagans mark their calenders by the eight fold year, with four major festivals and four minor. Solstices/equinox festivals are also recognised and celebrated."
cookies,a woman's wet vagina
Fergie,"(noun)1) Red faced observer of stop watches.2) Smug, arrogant pompous scot(verb)1) To get so mad you throw the nearest thing you see at the nearest person you see"
MAG,"Stands for ""Massive Action Game"". It is a first-party Playstation 3 exclusive that was release in 2009. It can hold up to 256 player online, simultaneously (a first for online games). It's a first-person-shooter."
OSM,"Entry: PRONOUCNED ->AwesomeSynonoms: Very Awesome, Pretty Awesome, Ridiculously Awesome, Sean ""Guy"" Capri, Disgustingly Awesome etc.Antonyms: Umm... Not Sean ""Guy"" CapriCome on look alive, Hutch...HUTCH!!!"
agnostic,One who believes that it is impossible to prove whether a supreme being (or a 'God') exists or not. An individualist who has finally realised that the statement 'Billions of mindless drones can't be wrong' is bull.
Marissa,"She is the hottest girl around and will always be there for you. She is amazing, gorgeous, funny, sweet, everything a guy could want in a girl. No other girl could ever compete with her, and she will always be someone's number one. She always makes your head turn as she passes you buy in the hall. She is like a magnet for your eyes. she is like a rainbow on a cloudy day, or a sun rise after a dark night. When she walks in a dark room she lights up the entire room just with her smile. when you see her you can not help but wish you had her in your arms. She has the most beautiful eyes you wish you could just sit and stare into them for hours on end. She has a beautiful body and anyone who doesn't have her is jealous of the guy that does. The guy that has her knows he is not good enough for her, for nobody is good enough for her she is an angel that fell from heaven and no normal guy, like anyone on this planet, can ever hope to have her. she is a goddess among humans. She is everything!!"
Papi Chulo,1. [Handsome] or [Sexy] [Daddy]2. A [loving] [nickname] or [pet name] to give your [boyfriend] if you're [Latina].
Linda Lovelace,"Female star of <i><b>Deep Throat</b></i>, and widely renowned for the depth to which she could orally insert John Holmes' legendary male member."
Milf,mother i'd love to $@&%
Transvestite Donkey Witch,Sarah Jessica Parker
Bootycall,"When someone of the opposite sex calls you up to ""hang out over your/their place"" (which in code means come over and have casual sex. Otherwise known as ""shoplifting the pootie"" -Jerry Mcguire.). It usually happens infrequently, without warning and normally occurs in the late night hours, resulting in hours of intense (if you're lucky lol) sex."
T-Pain,"The pain associated with listening to T-Pain's music.If condition worsens, seek Dr. Dre."
ciera,completely amazing. sweet. nice. funny. adorable. amazing personality. random. loving. cute. sexy. I LOVE YOU :)
Breast Smother,"When a woman pins down a man, then lowers her breasts onto his face, thus smothering him. Sometimes used in mixed wrestling. It is encouraged that all women with good-sized boobs do this. "
george w bush,A reason to move to [Canada].
lul,"LUL : ""Lame Uncomfortable Laugh""Internet slang term, derived from the popular ""LOL"" (laughing out loud).Usage of LUL is typically reserved for situations which make you feel uneasy."
Mick Ronson,"Mick Ronson (born Michael Ronson in Yorkshire, England, UK) was an awesome guitarist.  He may be most famous for being the lead guitarist of Ziggy Stardust and the Spiders from  Mars (David Bowie's band in the early 1970's).  He performed with Bowie later in his career as well.  Mick produced _Transformer_ (Lou Reed) and played piano and guitar on some of it). He had a solo career for a long time and played with people like Mott the Hoople, Lou Reed, and Bob Dylan.  Mick Ronson died in 1993 from liver cancer."
Autismbux,"(n.) Money collected from Social Security or a similar program on account of mental disability.""Autismbucks"", often spelled ""autismbux"", is a term used often on sites like 4chan, Reddit, Otaku boards, and NEET boards. Often used in a joking or derogatory sense, the term is usually used to refer to disability benefits acquired by NEETs, who often get their government handout by falsifying required documents, exaggerating an existing (minor) condition, or faking a mental disorder during medical examinations."
office space,"the movie, that really is a metaphor for life. You can't work all the time, you can't always follow the same routine. You sometimes need and event hence the death of the hypnosis doctor, to make you have a life change, to make one's life more meaningful"
flourish of strumpets,"A group of prostitutes, a gathering of whores, a collective term for ladies of ill repute."
Republicunt,"A blowhard loudmouth conservative female whom after insulting people that did not agree with her during the election and rambling incessantly about her candidate, still wont shut the fuck up and continues to act like a 3 year old throwing a tantrum for days after her party loses."
blackup,The calling in of nigras for extra assistance.
power dump,you know when you have to take a huge dump that youve held in for hours and then you take a poop and and it comes out like rapid fire and gets you wet. usually followed by a wet bumbum or ballsac and a really good feeling like the weight of the world has been lifted of your shoulders.
apeshit,"To loose all sense of reason. Said apeshitter will often start to speak in some strange language where the only recognisable words are ""fuck"" and other curses."
Black Widow,"A female who feeds off of the mental, physical and material means of a male and then leaves him for dead."
Khaylah,"Khaylah, an uncommon yet most unique girls name. Easily mistaken with Kayla, Gaylah and many other misused names. They are nice people to talk to and likes annoying others around them. They can have blonde moments, but are smart when they choose to be. They have a very bubbly personality and are easily amused and distracted. They are most commonly known for having the fuzzies in the mornings but are generally great people to talk to. They are nice, easy to get along with and are obsessed with their looks and hair."
alvaro,a guy who uses a girl to get off by fingering her.
normal,An adjective used by boring people to make themselves feel better.
Stellard,Totally intoxicated and anxious to pick a fight with anyoneFrom the lager brand Stella Artois
Pirates,"Pirates are a sea fearing folk, oft to be seen pilaging, raping, murdering, or commiting other acts of piracy. They usually own a monkey, parrot, or sexy wench."
Royal Marines,"The Amphibious Fighting Force of the United Kingdom.Created in 1664 now amongst the top two Regiments of the United Kingdom (the other being its rival the Parachute Regiment). Far superior to the US Marine Corps, in that they are Commandos, having completed 32 Weeks of basic training, with a 30 Mile Speed march in 8 Hours (7 Hours for Officers) and other tests of physical endurance.They come under the command of the Royal Navy, and have in their history been rewarded with 10 Victoria Crosses. "
Tom Fulp,Creator of the popular flash cartoon portal [Newgrounds]. Brother of [Wade Fulp].
Emma Watson,"Emma Watson is a 16 year old british brat. The only films she has been in are the Harry Potter series in which she is portraying herself. She claims her hair is ""naturally"" blonde even though her eyebrows are darker than a black cat. She likes to make stupid poses and faces during interviews and public appearences. Emma thinks Hermione is supposed to be the star of the Harry Potter series and is jealous of the attention Daniel Radcliffe and Rupert Grint recieve. She likes to pretend her hair is brown and frizzy like her character in harry potter but she is really portraying herself. Emma likes to bitch at people on set and roll her eyes during long interviews when asked the same questions more than once. She also is very fond of screwing up Hermione's character in the harry potter movies by wearing massive amounts of pink (including the yule ball dress which should have been blue), stealing characters lines, punching (instead of slapping) draco malfoy, and curling her hair. Emma also is fond of alcohol, considering the amount of candid photos we have seen with her drinking a corona beer (The drinking age in the U.K. is 18, emma is 16). Her fans consist of pre-teen girls who love Hilary Duff, wear training bras, tYpE LyKe DisSs!!1!1!!!111!!eleventy!!1one!! and 11 year old boys who secretly steal their mothers victorias secret catalogue. Emma Watson is europe's biggest child celebrity idiot."
Albiotard,"A type of mountain bike rider that frequents Albion ""Hills"" trail system near Toronto, Canada, that believes all trails should be sanitized for beginner riders and boring for experienced riders by removing obstacles or advanced features on trails making it easier to ride.."
dirty twerk,when a girl in a short skirt is twerking a guy and intentionally sharts on the guy's junkhood...
democrat,"one of the two major political parties apparently dedicated in removing rights givin to man by god, completely ignorant to what the founding fathers believed in, and utterly desperate to take the political power from the people and hand it to an increasingly powerful government. Also convinced their opinion is the absolute truth and that republicans are evil for holding their own."
