word,definition
Knob Jockey,"A person, usually of the female gender, who has a particular penchant for 'riding' a knob. The term is therefore usually used as a derogatory expletive in reference to men, implying that the said person is homosexual and therefore sub-standard"
Jager Secret,The act of revealing information disseminated to a confidant during a period of intoxication.To break a Jager secret is to break all trust between bro'sThe phrase popularised by Ron Swanson
nuclear launch detected,"1.Originally from the game [Starcraft] made by Blizzard. It's what happens when a ghost designates an area for a nuclear explosion from a nuke sent by the nuclear silo attatched to the command center. When you hear it and see it in its white glory words, you are seeing and hearing doom and destruction.2.Derived from [Starcraft], when ever you feel gas, just go ""Nuclear Launch Detected"" and the closest person next to you will run away, then you release it. "
Shawn Michaels,The greatest wrestler ever. Period. He owns you. And he did not screw over Brett Hart damnit. It was Vince. It was all his fault.
xoxo,"Hugs and Kisses. O's = Hugs, X's = Kisses. You can just put O's if you haven't shared a kiss with the person yet."
alcoholism,drinking like you're in college when you're no longer actually in college.
Obama,"The 44th President of the U.S. First African American President, and the coolest President to ever be elected"
Moobs,"A man with boobs, usually fat men have moobs. (.)(.)Pronounced: [moo-bz]"
Miya,"It means ""Princess"" in Japanese.And it is a Japanese name, for a girl.or it can mean somebody is really really really nice, and they are so pretty aswell."
izzle,"Contrary to popular belief, Snoop Dogg was NOT the originator of the izzles, E-40 created it back in the mid-90's."
Job Corps,"IN GENERAL:The Food was gross (as a vegetarian, they once served me a RAW POTATO for dinner!!) ...But it was FREE!The dorms were old and falling apart (The furnace would decide to stop working in the middle of winter and blow out FREEZING cold air, it would take a minimum of 3 days to get maintenance in to fix it) ...But it was a FREE bed to sleep in!The roommates were immature, loud, and freakin INSANE! (I watched this one girl make out with her stuffed animal dog for an hour before crying herself to sleep) ...But it taught you INTERPERSONAL SKILLS!The leaders in dorm were full of themselves, gave bad advice, and some even stole things from others. (My room leader once during chores got into my dresser and stole $35 dollars out of my I.D. Pouch) ...But they taught you how NOT to be a leader!The staff liked to patronize the students. Most were write-up happy. (We sometimes got write ups for walking in the grass) ...But the ones that really cared about the students would have done ANYTHING to help us out!All-in-AllJob corps really sucked, but if you go in with the right head about things and follow the rules (no matter how pathetic they are) you'll survive just fine! Job corps was good for me, and good for a ton of other people too!...oh! Did I mention that they PAY YOU TO RECEIVE A FREE EDUCATION?!?! That's right, YOU GET MONEY FOR IT!!!"
Rakim,Rakim this crazy cat who revolutionized and took hip hop 2 a new level with his lyrical content he's responsible 4 such products as eminem he alone holds the greatest mind in hip hop.
Fergie,Some bitch who sings in Black eyed Peas and also does solo stuff. Once peed her pants onstage at a concert and all in all she sucks.
animal rights,"A philosophy that suggests some or all animals have the right to possess their own lives. Contrary to popular opinion, animal rights activists do not ask for voting rights for chickens or pigs. Rather they ask that animals not be used for food, entertainment, medical research or clothing. Some activists maintain that there is a distinction between sentient, or self-aware animals, and those with a large degree of self-awareness are to be afforded the right to possess their own lives. Animal rights is also largely tied to dietary lifestyles such as [vegetarianism] and [veganism] which abhor the consumption of meat products in accordance with the principles of animal rights.Animal rights movements are not the same as [animal welfare] which take into account, the suffering of animals (and seek to prohibit it) but do not grant them specific rights"
american university,"For those in the know, AU is THE University to find a girl in the DC area worth dating.  While Georgetown students are busy popping their pink collars, GW students are busy paying for an overpriced education, and Catholic students are busy being Catholic, American University is an absolute goldmine for intelligent girls (or men, if you swing that way).  For people that actually want to make a difference and not just ride Daddy's coattails to a soul-sucking Legal/Medical profession, AU is where it's at. "
pigeonhole,to put something into a drawer/box and forget about it for a long term.to have unfair idea of what type sb or sth is.
pfft,When you disapprove of something
rosebud,The appearance of one's rectum after [fisting]. The internal tissue pulls out beyond the sphincter muscle. The bright red to pinkish tissue looks like a rosebud.
Ifra,The goddess of heaven and earth who brings much light to earth. Has the beauty of an egyptian queen and a body to DIE FOR. Deeply desired by the opposite sex. Often used in sentences to describe a woman who is hot and sexy but at the same time pure and gentle in the inside. 
Italian,"An incredibly cultured people who work hard and are not considered white by white people and yet not considered minorities to the WASP-ass government.Sometimes get a bad rep because of movies and shows where they are depicted as gangsters. Italian women are strong-willed, hard-working, and completey hot just like Irish and Black women. Usually have beautiful olive skin and dark hair. Italian men love their families and work hard and many are incredibly intelligent, despite what it shows in the movies. Leonardo DiVinci, an Italian man, was one of the smartest men in the world. Italians are also great artists. An Italian discovered America, an Italian named America, the Italians slave to make a better life while WASPs like Peter kick us in the face. And don't sit there rolling your eyes, whities, because I know you would support this  if another minority wrote this, but simply because you think I'm Italian you blow this off. ""I'll pretend to give a rats ass about what blacks and asians say because it's the cool thing to do, but I don't care about Italians."" You're hypocrites. All minorities, Italians, blacks, hispanics, need to come together."
tara reid,"A girl that is nothing but a fake, attention-whoring, peroxide-saturated, saggy implant-ridden, botox-filled cum recepticle. Can't act worth 9 shits as proven by ""My Boss' Daughter""."
smack,"gossip, talkin shit about one another,"
Paula Abdul,"Small, cute, and extremely talented singer and choreographer. Is now a judge on popular TV show American Idol. Has had several relationships that turned out badly in her lifetime but has finally found her true love in fellow judge Simon Cowell. Now if only the two would just freaking admit their love for each other!"
baby mama,Basically a woman you had a child or children with who you didnt marry and or no longer involved with.Usually associated with hoodrats and trailer park bitches.
hubbas,crack rocks. baking soda and cocaine. rocks.
sketch pad,"A private place of residence that has a steady flow of shady visitors due to the nature of business within said dwelling, i.e. the exchange of cash for black market goods and/or services, such as illegal drugs, weapons, prostitution, or some combination thereof.   "
DPMO,"DPMO is the easiest way to tell someone not to piss you off via text message, twitter, facebook etc. directed towards a specific person. acronym for Dont Piss Me Off.can be used also with a [stale face]"
sexual harassment,1. Persistent unwanted romantic advances2. Any act that can be perceived by the receiving party as a sexual advance3. A sexual advance
Stuart,Is a Hull word for a certain type of man who is sexy and gorgeous but knows the effect that he can have on a woman.A Stuart can understand just what a women wants and tease her with it.Stuart's on a whole are known for there self survival tactic which is called a Stuart hug. A Stuart hug is generally a long embrace which involves amazing kisses and lots of fondling or gropes depending on his prey.
Tool (band),"An alternative/progressive metal band started in Los Angeles in 1990. Easily identifiable by their rough, complex, bass-driven rythms, as well as the vocals and complex, deep lyrics of frontman Maynard James Keenan.Their first two albums, Opiate and Undertow, dabbled in alternative metal, post-metal, and even grunge influences. Their later albums, Ænima, Lateralus, and 10,000 Days, are progressive/art rock influenced. The band spans several genres and is one of the most influential metal bands in recent memory.Often called the inspiration of the nu-metal genre, an enormous disrespect to Tool. When Tool was formed, they were one of the first alternative metal bands. Today, countless nu-metal bands copy this style and attitude, and all list Tool as their primary influence, despite only taking in the surface noise and angst from Tool and none of their depth, complexity, or talent. This mockery came to a climax when shitcore band Limp Bizkit did a cover of Opiate in concert, which was full of whines and lyrical mishaps. Worst of all, the 6-minute song was condensed to a 2-minute rap.Tool's masterpieces include the songs; H., Forty-Six and 2, Eulogy, Sober, Jambi, Prison Sex, Opiate, Pushit, a cover of Led Zeppelin's classic No Quarter."
Byron,The one that completes me. The one that gives me hope. The one that makes me whole. The one that captures my heart.The one that is the meaning of life. The one that is the love that carries me through the day.
regret,"The most painful thing one can ever experience...The feeling of doing something that you wish you had never done. Feeling regret, you would do anything to turn back the hands of time... Or die to get away..."
Bertstare,"An implied facepalm, usually used in the form of ""bertstare.jpg""; used when someone says or does something so stupid that words cannot describe how one feels, and a conventional facepalm is not worth the effort."
Viridiana,"pronounced ver-id-ee-AHN-ah. It is of Latin origin, and its meaning is ""green"". An Italian saint's name."
Industrial Metal,Better than your bullshit music I bet.
Louisiana,"Louisiana has some of the nicest people I've ever seen. I'm from North Louisiana and I've traveled alot. I'm used to waving to people and getting a wave back, only in Louisiana. That's southern generosity for you :) Nothing like nice Southern people with funny accents. So if your visiting Louisiana, don't be afraid to wave to us, We'll wave right back and problaby strike up a conversation with you that consists of more knowledge about our personal lives than you ever wanted to know. "
postmodernism,Imagine that on everyone's hand there is a penis and a vagina. Now imagine what it would be like to shake hands with someone. 
marijuana prohibition,"Gay,retarded,dumb,stupid,queer,lame,killfagz!Big tobacco companies put shit in cigarettes ON PURPOSE to make them more addictive and more deadly.This of course helps their sales and also helps the medical industry!We used to have SLAVERY in this country and most of those slaves were forced to work on cotton and tobacco plantations.That's where these big tobacco fucks come from.They have much support in congress and the government.So how dare they tell me I can't smoke pot and how dare they call pot smokers immoral?That's the pot calling the fucking kettle black!THEY'RE IMMORAL!"
Nightwish,"One of the greatest bands in the world, featuring one of the greatest singers in the world, Tarja Turunen.  They prove that you don't have to use the word ""pain"" in every other song in order to write lyrics, that girl singers (and rock singers in general) do not have to whine, and that talented musicians can and do show off their skill playing in metal bands.  Oh, and they also used the same orchestra from the Lord of the Rings soundtrack on their album ""Once""."
montreal,A liberal city where everyone knows how to have a good time!
the clash,"One day, in the late-mid 70s, God decided that he had given the 20th century enough shit with 2 world wars and so he made it up by inventing Punk rock. Sadly, one of the first, and most famous bands (The Sex Pistols), were acting like complete dicks (who happend to amke brilliant yet simple music). God decided to take things into his own hands and created The Clash. This band were the greatest band of the time and are most probably the greatest band ever. The trancended the punk lebel and fused their music with jazz, dub,rap and regae, but never failed to make their music brilliant.If The Clash weren't gods themselves, they were certainly blessed by the Almighty One.Singer Joe Strummer died just before Christmas 2002. His final album was almost complete, it was released the next year and is absoultely brilliant. It is called Streetcore and is on hellcat records."
platonic love,Deep connection bewtween two people with no sexual desire or romantic attachment.
Eris,"A goddess, presides over Discord and Chaos. Greek mythos."
Jeff Buckley,The late singer and guitarist. Pure perfection.
dream theater,"Progressive metal band that has existed since 1985, famed for their instrumental prowess and compositional skill. Its three core members, guitarist John Petrucci, bassist John Myung, and drummer Mike Portnoy were students at the Berklee College of Music. They are perhaps the only prog-metal band to be signed to a major label. Nay-sayers claim that DT's music is nothing but pretentious wankery. With one or two brief exceptions, the above accusation is outright farcical."
Hannah,"Extremely sexy, fantastic at giving blow jobs and is in love with a Marine"
perpin,To lie when you know that your aren't being honest.
grimace,Ronald Mc donalds autistic freind.
paramore,"Every once in a while, you stumble across a band that can actually pull off having a female lead singer and still rock out. This band is from Franklin, TN and trust me, they are going places. Hayley Williams (lead vocalist) has superb talent for her age. This is probably one of the most underrated bands out there..."
Beavis and Butthead,"The only reason most people watched [MTV].  Sadly, the corporate fuckers killed the show off and fired Mike Judge.  Now we have to watch King of the Hill just to get some reminders of its predecessor."
Trump's Ban,"That which might ironically end up making America less safe and more prone to radical Islamic terrorism, as alienated [moderate Muslims] get recruited by terrorist groups."
wyoming,"The state with the lowest population. Home to towering mountains and spacious plains. Populated pre-Columbus by the Shoshone, Crow, and Lakota Indians. Currently populated with cowboys, roughneck oilfield workers, Indians, and generally nice people who love the outdoors, and hate the way the rest of America lives. 90 percent of said population could probably kick your ass in half. By the by, not a favorite place for homosexuals (remember Matt Shepard?). Yes, everyone in Wyoming has a gun, and really wants to shoot something. "
canadian boobies,Boobies belonging to a Canadian woman. Sometimes the boobies get cold in the winter.
Swetha,"A Swetha is a gorgeous Indian girl with a heart of gold. She is a fierce dancer and a great friend. She is kind, fabulous, and lovely. She is also outrageously smart, she's a friggin' genius. She's fantastically gorgeous, a total stunner, she's tall and lean-she would be a great model.She is one of the most fun people you could ever wish to meet.Person 1: ""Who's that gorgeous Indian?""Person 2: ""She's a Swetha."""
Rage Quitting,"A conditon in which gamers, through steady provoking, simply cannot take being killed (cheaply or otherwise) anymore and leave a online game game mid-match. Mostly occurs in multiplayer first person shooters. I.E [Call Of Duty] or [Halo].Warning signs preceding this action include-The throwing of said gamers controller-Rampant punching of a sofa/love seat-Yelling at family members/roommates-Letting loose a stream of expletives and complaining over in-game chat"
new zealand christmas,the act of vomitting on your loved one in bed on christmas eve and then just turning over and going back to sleep.
Aurora,"The most beautiful girl in the universe, with short black and brown hair with gorgeous brown eyes. She is sexy and incredibly funny and caring. Great person to hangout with"
The Beatles,"Considered one of the first Boy Bands marketed heavily to teens of the Baby Boomer generation, and among the most influential to pop music, their early songs were catchy pop tunes. During their later psychedelic drug phase, they wrote a lot of nonsense lyrics like I Am The Walrus and Yellow Submarine with catchy tunes, too.John Lennon became the most controversial member because of his social conscience, criticism of the Establishment, and opposition to war and bigotry."
SUPEReeeGO,he is like the most famous mexican youtube celebrity. he is a comedian and likes to do cholo sketches which are funny.his videos are the bomb and will soon take over youtube.
india,Where every company outsources our jobs to.
How to tell if you're an idiot,[How to tell if you're an idiot]
Jasmyne,"A [unique] girl . She loves to [laugh] and [smile]. She's not afraid to act completely [crazy] with her friends. She can be [moody] . She's the type of girl who can give you a headache one day and a smile the next. She's [protective] over what/who she loves and doesn't easily give up on what she wants. She's [friendly] , [pretty] , and a little [childish] , but all the same , still [loveable]. Jasmyne is someone who does things her own way (that's usually out of the ordinary!). She's definantly [irreplaceable] and unforgetable."
mac 11,"Both MAC10 and MAC11 are compact and reliable guns, capable of delivering a good amount of firepower due to high rate of fire (1100 rpm for MAC11 and a striking 1600 rpm for MAC11 in .380). But the light weight and high rate of fire resulted in marginal accuracy and relatively short effective range, thus make the MACs the good choice for building sweeps and inside-the-vehicle operations"
good looks,Aother way to say thank you.  When you don't want to sound gay by telling another guy that you appreacate what he did for you
slut busting,"Spotting and or declaring a girl who is inappropriately dressed like a ""slut""."
Elana,Someone who is beautiful and sexually alluring attracting everyone she meets.
vagina,best fucking thing ever. period.
JROTC,"JROTC is an elective class for high school students who want to learn leadership skills,how to be a better citizen,who are interested in the military,and want to learn other skills that will make them a better person."
Argo,A Ship that sailed to get the golden fleece (Greek Mythology)
North Dakota,"The state with the lowest age to be able to get a driver's license, which is 14."
Candis,"A care giver at heart. Hard working, trustworthy, reliable, compassionate person. Loves life, friends and family. Will do anything for a person in need. Awesome friend and easy to get along with."
poppin,"going on, happening"
shnookums,"A very affectionate term for a significant other, used in situations where you are alone with the person generally, or with other people and you wish to embaress said S.O."
Smoothed-em,An expression used when defying how you took control of a situation.
zig zags,papers used to roll weed in
Keith,"A gorgeous man you are in love with who flirts with you consistently, in a misleading way, but refers to you as a sister/member of the family. "
kayla,"The prettiest girl on earth,popular and is sweet as candy she would start singing at random moments no matter where she is. THE FUNNIEST EVER"
pain olympics,a shock video on the internet in which a man cuts off his own penis.
Osvaldo,"A hott guy who respect women , and who doesn't thinks he can mess with anyone and everyone and treat 'em like crap . He is the oppose of a loser. Every female should mess with a guy named Osvaldo. He is a not a player, he is a Lover. A person only likes to make his girl special. Only a jerk would be jealous of him"
Hana,Irresistible. Insanly beautiful. The cats meow. Comes from the word HELLARIOUS. She makes you laugh.
goldbricker,"Someone who cheats at completing a task, duty, or job. To cheat; swindle."
Alaina,The person with the sexiest duck face ever.
Justin Beiber,"Some 11 year old faggot who thinks he can sing. He is a disgrace to music. 11-14 year old tweens love him. No one loves him. Stop standing up for him. He is a brat, a twit, and I'm personally the only female who hates him with a firey soul. Justin Beiber will never get laid. Justin Beiber will never get the girl. Justin Beiber will never love you."
Joaquin,"A very talented young man, very attractive and muscular. One of the bravest men you will ever meet and capable of anything due to his confidence. Ladies are usually thrilled when they hear about this man because he is down to earth and friendly but can have one heck of an attitude."
Samaria,The coolest person alive and is very beautiful and smart.
oreo,"Term for African Americans that the black community is generally offended with for betraying their roots usually for dating caucasion girls, dressing too white, talking too white, etc.  The term is branded OREO since they are ""Black on the outside, White on the inside"""
the tits,"The same as The Shit, only better because tits are great and shit isn't."
Chawner,"A fat, lazy, benefit-seeking bludger."
Andersexual,The sexual orientation of otherwise straight women and homosexual men who are confused about their attraction to Gillian Anderson.
Bob,"A name that people name imaginary people, or call themselves.  They think it is the funniest thing ever, when it is actually just stupid.  These people should not be encouraged.  They should be stabbed in the eye instead."
origin of the word honky,"Niggers being to stupid to understand what automobiles actually were, would yell the word [honky] at the [Caucasian People] operating these automobiles as they sounded their automobile horns trying to get all the niggers out of the street."
eshay,"is a penrith expression used by all the ESHLADS. it simply is 'yes' in piglatin, but with a H instead of the Y. it is used to refer to these people who think they are this shit in penrith and surrounding areas. they aer identified as  the idiots walking around in canterburys, striped polos, usually nautica, and nike tn's with a tiny backpack, and a fag lit in their hands annd then one behind their ear. the original annd only eshlads are the jamison boys who thought of it annd then theres just the retards who think they are esh just cause they wear the same stuff as them annd smoke. usually think they own penrith plaza, ha well they are mistaken. try and start shit but alwasy are like nahh man ill just go get my crew. and then fuck off. then tell their mates oh bro i full kicked the shit out of these fuckers today. when infact they pussyed out."
beelzebub,"Beelzebub, a translation of Baal-zebub. Both translate to Lord of Flies (more commonly), or Lord of the Dungheap. Because flies often gather around decaying corpses and as well spread disease, the term is symbolic for Lord of Death, Decay, Disease, etc. Beelzebub is either used as a synonym for Satan himself, or, as was made popular in Paradise Lost, as Satan's second-in-command devil."
Hasse,#NAME?
Natasha,"a natasha is known all around for her [legs] and bright smile. her hair is always [perfect] and she gets along with everyone.natasha=one word. legs. a natasha is a very [athletic] being, with an excellant [body] that girls want to have and guys want to do.be warned though, natasha will fly off the handle if betrayed by one of her friends. she is extremely [trusting], and only her true friends will not take advantage of it."
the wiggles,"A wildly popular Australian musical group that targets toddlers, fashioned after [The Monkees] and [H.R. Pufnstuff]. The characters are played by attractive middle-aged men, which also appeals to the mothers of the toddlers. Often assumed as gay by those outside their target audience (the fact that their target audience is of an age that doesn't comprehend sexual orientation makes the issue irrelevant; however four of them are married with children - yet another facet that makes them attractive to moms). "
hypnotiq,"The best tasting vodka ive ever had, you cant even taste the alcohol in it. very easy to down and great for mixing. awesome with blue faygo."
King DOM,"n. 1. King of Dirty Old Men2. Kingdom of Dirty Old Men3. A DOM that encourage other man to transform from [closet pervert] to a proud [DOM].A man with the dirtiness that can out [DOM] the rest of the DOM. Basically the leader of all dirty old men. To be a King DOM you gotta be witty as well on top of plain dirtiness. He has to be able to crack dirty jokes subtly or straight up vulgar.It can also be referred to as the circle of [DOM], their [kingdom].Their activities includes but not limited to perving at females and male, thinking about [sex] all day, watching porn, making dirty jokes, masturbating, fucking, stealing women underwear as collections, butt pinching and whatever they can get."
Pleasant Grove,"Thoedest Mutha Fuckin Place In Dallas.  Home of da freestylas, djs, hustlaz, and headbustaz"
